<?xml version="1.0" encoding="UTF-8"?>
<!DOCTYPE timeslots SYSTEM "classSchedule.dtd">

<timeslots>
    <timeslot start="13:30" finish="15:30">
        <daySchedule day ="Monday">
            <course>
                <courseID id="4770"></courseID>
                <className></className>
                <classLocation></classLocation>
                <classActivity activity="tutorial"></classActivity>
            </course>
        </daySchedule>
    </timeslot>
    <timeslot start="10:30" finish="12:30">
        <daySchedule day ="Tuesday">
            <course>
                <courseID id="4620"></courseID>
                <className></className> 
                <classLocation></classLocation>
                <classActivity activity="lab"></classActivity>
            </course>
        </daySchedule>
    </timeslot>
    <timeslot start="15:30" finish="17:30">
        <daySchedule day ="Tuesday">
            <course>
                <courseID id="4620"></courseID>
                <className></className> 
                <classLocation></classLocation>
                <classActivity activity="lecture"></classActivity>
            </course>
        </daySchedule>
    </timeslot>
    <timeslot start="12:30" finish="14:30">
        <daySchedule day ="Wednesday"> 
            <course>
                <courseID id="4850"></courseID>
                <className></className>
                <classLocation></classLocation>
                <classActivity activity="lecture"></classActivity>
            </course>
        </daySchedule>
    </timeslot>
    <timeslot start="10:30" finish="12:30">
        <daySchedule day ="Thursday">
            <course>
                <courseID id="4850"></courseID>
                <className></className>
                <classLocation></classLocation>
                <classActivity activity="lab"></classActivity>
            </course>
        </daySchedule>
    </timeslot>
</timeslots>
