<?xml version="1.0" encoding="UTF-8"?>
<!DOCTYPE days SYSTEM "classSchedule.dtd">
<!--
    Document   : days_facet.xml
    Created on : March 06, 2016
    Author     : Khang
    Description:
        The days of of the week of our winter 2016 class schedule. This xml 
        document displays the days of the week from Monday-Friday
-->
    <days> 
        <daySchedule day ="Monday"> 
            <timeslot start="13:30" finish="15:30">
                <course>
                    <courseID id="4770"></courseID>
                    <className></className>
                    <classLocation></classLocation>
                    <classActivity></classActivity>
                </course>
            </timeslot>
            <timeslot start="13:30" finish="15:30">
                <course>
                    <courseID id="4770"></courseID>
                    <className></className>
                    <classLocation></classLocation>
                    <classActivity></classActivity>
                </course>
            </timeslot>
        </daySchedule>
        <daySchedule day ="Tuesday"> 
            <timeslot start="10:30" finish="12:30">
                <course>
                    <courseID id="4620"></courseID>
                    <className></className>
                    <classLocation></classLocation>
                    <classActivity activity="lab"></classActivity>
                </course>
            </timeslot>
            <timeslot start="15:30" finish="17:30">
                <course>
                    <courseID id="4620"></courseID>
                    <className></className>
                    <classLocation></classLocation>
                    <classActivity activity="lecture"></classActivity>
                </course>
            </timeslot>
        </daySchedule> 
        <daySchedule day ="Wednesday"> 
            <timeslot start="12:30" finish="14:30">
                <course>
                    <courseID id="4850"></courseID>
                    <className></className>
                    <classLocation></classLocation>
                    <classActivity activity = "lecture"></classActivity>
                </course>
            </timeslot>
        </daySchedule>  
        <daySchedule day ="Thursday"> 
            <timeslot start="10:30" finish="12:30">
                <course>
                    <courseID id="4850"></courseID>
                    <className></className>
                    <classLocation></classLocation>
                    <classActivity activity="lab"></classActivity>
                </course>
            </timeslot>
        </daySchedule> 
        <daySchedule day ="Friday"> 
        </daySchedule> 
    </days>


